### ISSUE TITLE
Incompatibility with OpenSSH 7.3p1

### ISSUE THREAD

**Issue by serjtc** [sshnet/SSH.NET#112]
Hi,

after updating the OpenSSH 7.2 to the Version 7.3p1, a connection to the server using ssh.net is not possible anymore. 

Logs:
```
"Test.vshost.exe"` (Verwaltet (v4.0.30319)): 
SshNet.Logging Verbose: 6 : Initiating connect to '192.168.1.1:22'.
SshNet.Logging Verbose: 6 : Server version '2.0' on 'OpenSSH_7.3'.
SshNet.Logging Verbose: 14 : [] ReceiveMessage from server: 'KeyExchangeInitMessage': 'SSH_MSG_KEXINIT'.
SshNet.Logging Verbose: 14 : [] SendMessage to server 'KeyExchangeInitMessage': 'SSH_MSG_KEXINIT'.
SshNet.Logging Verbose: 14 : [] SendMessage to server 'KeyExchangeDhGroupExchangeRequest': 'SSH_MSG_KEX_DH_GEX_REQUEST'.
SshNet.Logging Verbose: 14 : [] ReceiveMessage from server: 'KeyExchangeDhGroupExchangeGroup': 'SSH_MSG_KEX_DH_GEX_GROUP'.
Der Thread '<Kein Name>' (0x169c) hat mit Code 0 (0x0) geendet.
Der Thread '<Kein Name>' (0x2bc8) hat mit Code 0 (0x0) geendet.
SshNet.Logging Verbose: 14 : [] SendMessage to server 'KeyExchangeDhGroupExchangeInit': 'SSH_MSG_KEX_DH_GEX_INIT'.
SshNet.Logging Verbose: 14 : [] ReceiveMessage from server: 'KeyExchangeDhGroupExchangeReply': 'SSH_MSG_KEX_DH_GEX_REPLY'.
Eine Ausnahme (erste Chance) des Typs "Renci.SshNet.Common.SshOperationTimeoutException" ist in Test.exe aufgetreten.
SshNet.Logging Verbose: 6 : 636143740562809350 Disposing client
SshNet.Logging Verbose: 6 : 636143740562819350 Disconnecting client
SshNet.Logging Verbose: 6 : [] Disposing session
SshNet.Logging Verbose: 6 : [] 636143740562859353 Disconnecting session
SshNet.Logging Verbose: 6 : [] Shutting down socket.
SshNet.Logging Verbose: 6 : [] Disposing socket.
SshNet.Logging Verbose: 6 : [] Disposed socket.
Der Thread '<Kein Name>' (0x3970) hat mit Code 0 (0x0) geendet.
Eine Ausnahme (erste Chance) des Typs "Renci.SshNet.Common.SshConnectionException" ist in Test.exe aufgetreten.

```
=================
```
# ssh -V
OpenSSH_7.3p1, OpenSSL 1.0.2h  3 May 2016

# cat /etc/sshd.conf
Protocol 2
MaxStartups 3
MaxAuthTries 4
LoginGraceTime 60
ClientAliveInterval 600
ClientAliveCountMax 0
TCPKeepAlive no
UseDNS no
UsePAM yes
UsePrivilegeSeparation no
PermitRootLogin yes
HostKey /etc/certs/ssh_rsa_key
Subsystem sftp /usr/libexec/sftp-server




Server Protocol: 
Frame 20: 75 bytes on wire (600 bits), 75 bytes captured (600 bits) on interface 0
Ethernet II, Src: TecoAS_84:bc:63 (00:0a:14:84:bc:63), Dst: Broadcom_cc:0e:a4 (00:10:18:cc:0e:a4)
Internet Protocol Version 4, Src: 192.168.1.1, Dst: 192.168.1.2
Transmission Control Protocol, Src Port: 22, Dst Port: 63563, Seq: 1, Ack: 1, Len: 21
SSH Protocol
    Protocol: SSH-2.0-OpenSSH_7.3\r\n


Client Protocol:	
Frame 21: 92 bytes on wire (736 bits), 92 bytes captured (736 bits) on interface 0
Ethernet II, Src: Broadcom_cc:0e:a4 (00:10:18:cc:0e:a4), Dst: TecoAS_84:bc:63 (00:0a:14:84:bc:63)
Internet Protocol Version 4, Src: 192.168.1.2, Dst: 192.168.1.1
Transmission Control Protocol, Src Port: 63563, Dst Port: 22, Seq: 1, Ack: 22, Len: 38
SSH Protocol
    Protocol: SSH-2.0-Renci.SshNet.SshClient.0.0.1\r\n
	

Server Key Echange Init:
Frame 23: 1086 bytes on wire (8688 bits), 1086 bytes captured (8688 bits) on interface 0
Ethernet II, Src: TecoAS_84:bc:63 (00:0a:14:84:bc:63), Dst: Broadcom_cc:0e:a4 (00:10:18:cc:0e:a4)
Internet Protocol Version 4, Src: 192.168.1.1, Dst: 192.168.1.2
Transmission Control Protocol, Src Port: 22, Dst Port: 63563, Seq: 22, Ack: 39, Len: 1032
SSH Protocol
    SSH Version 2 (encryption:aes256-ctr mac:hmac-sha1 compression:none)
        Packet Length: 1028
        Padding Length: 8
        Key Exchange
            Message Code: Key Exchange Init (20)
            Algorithms
                Cookie: 6cb439a8ff32cedc87fc9b6fa7d0e539
                kex_algorithms length: 240
                kex_algorithms string [truncated]: curve25519-sha256@libssh.org,ecdh-sha2-nistp256,ecdh-sha2-nistp384,ecdh-sha2-nistp521,diffie-hellman-group-exchange-sha256,diffie-hellman-group16-sha512,diffie-hellman-group18-sha512,diffie-hellman-group1
                server_host_key_algorithms length: 33
                server_host_key_algorithms string: ssh-rsa,rsa-sha2-512,rsa-sha2-256
                encryption_algorithms_client_to_server length: 108
                encryption_algorithms_client_to_server string: chacha20-poly1305@openssh.com,aes128-ctr,aes192-ctr,aes256-ctr,aes128-gcm@openssh.com,aes256-gcm@openssh.com
                encryption_algorithms_server_to_client length: 108
                encryption_algorithms_server_to_client string: chacha20-poly1305@openssh.com,aes128-ctr,aes192-ctr,aes256-ctr,aes128-gcm@openssh.com,aes256-gcm@openssh.com
                mac_algorithms_client_to_server length: 213
                mac_algorithms_client_to_server string [truncated]: umac-64-etm@openssh.com,umac-128-etm@openssh.com,hmac-sha2-256-etm@openssh.com,hmac-sha2-512-etm@openssh.com,hmac-sha1-etm@openssh.com,umac-64@openssh.com,umac-128@openssh.com,hmac-sha2-2
                mac_algorithms_server_to_client length: 213
                mac_algorithms_server_to_client string [truncated]: umac-64-etm@openssh.com,umac-128-etm@openssh.com,hmac-sha2-256-etm@openssh.com,hmac-sha2-512-etm@openssh.com,hmac-sha1-etm@openssh.com,umac-64@openssh.com,umac-128@openssh.com,hmac-sha2-2
                compression_algorithms_client_to_server length: 21
                compression_algorithms_client_to_server string: none,zlib@openssh.com
                compression_algorithms_server_to_client length: 21
                compression_algorithms_server_to_client string: none,zlib@openssh.com
                languages_client_to_server length: 0
                languages_client_to_server string: [Empty]
                languages_server_to_client length: 0
                languages_server_to_client string: [Empty]
                KEX First Packet Follows: 0
                Reserved: 00000000
            Padding String: 0000000000000000


			Client Key Echange Init:			
Frame 24: 950 bytes on wire (7600 bits), 950 bytes captured (7600 bits) on interface 0
Ethernet II, Src: Broadcom_cc:0e:a4 (00:10:18:cc:0e:a4), Dst: TecoAS_84:bc:63 (00:0a:14:84:bc:63)
Internet Protocol Version 4, Src: 192.168.1.2, Dst: 192.168.1.1
Transmission Control Protocol, Src Port: 63563, Dst Port: 22, Seq: 39, Ack: 1054, Len: 896
SSH Protocol
    SSH Version 2
        Packet Length: 892
        Padding Length: 14
        Key Exchange
            Message Code: Key Exchange Init (20)
            Algorithms
                Cookie: 4c933a17babe9a9fa5e082ec8aec8e94
                kex_algorithms length: 126
                kex_algorithms string: diffie-hellman-group-exchange-sha256,diffie-hellman-group-exchange-sha1,diffie-hellman-group14-sha1,diffie-hellman-group1-sha1
                server_host_key_algorithms length: 15
                server_host_key_algorithms string: ssh-rsa,ssh-dss
                encryption_algorithms_client_to_server length: 186
                encryption_algorithms_client_to_server string: aes256-ctr,3des-cbc,aes128-cbc,aes192-cbc,aes256-cbc,blowfish-cbc,twofish-cbc,twofish192-cbc,twofish128-cbc,twofish256-cbc,arcfour,arcfour128,arcfour256,cast128-cbc,aes128-ctr,aes192-ctr
                encryption_algorithms_server_to_client length: 186
                encryption_algorithms_server_to_client string: aes256-ctr,3des-cbc,aes128-cbc,aes192-cbc,aes256-cbc,blowfish-cbc,twofish-cbc,twofish192-cbc,twofish128-cbc,twofish256-cbc,arcfour,arcfour128,arcfour256,cast128-cbc,aes128-ctr,aes192-ctr
                mac_algorithms_client_to_server length: 147
                mac_algorithms_client_to_server string: hmac-md5,hmac-md5-96,hmac-sha1,hmac-sha1-96,hmac-sha2-256,hmac-sha2-256-96,hmac-sha2-512,hmac-sha2-512-96,hmac-ripemd160,hmac-ripemd160@openssh.com
                mac_algorithms_server_to_client length: 147
                mac_algorithms_server_to_client string: hmac-md5,hmac-md5-96,hmac-sha1,hmac-sha1-96,hmac-sha2-256,hmac-sha2-256-96,hmac-sha2-512,hmac-sha2-512-96,hmac-ripemd160,hmac-ripemd160@openssh.com
                compression_algorithms_client_to_server length: 4
                compression_algorithms_client_to_server string: none
                compression_algorithms_server_to_client length: 4
                compression_algorithms_server_to_client string: none
                languages_client_to_server length: 0
                languages_client_to_server string: [Empty]
                languages_server_to_client length: 0
                languages_server_to_client string: [Empty]
                KEX First Packet Follows: 0
                Reserved: 00000000
            Padding String: 065ebad4b272a55370d8925c5fbf

Client DH Groupe Exchange Request:
Frame 25: 86 bytes on wire (688 bits), 86 bytes captured (688 bits) on interface 0
Ethernet II, Src: Broadcom_cc:0e:a4 (00:10:18:cc:0e:a4), Dst: TecoAS_84:bc:63 (00:0a:14:84:bc:63)
Internet Protocol Version 4, Src: 192.168.1.2, Dst: 192.168.1.1
Transmission Control Protocol, Src Port: 63563, Dst Port: 22, Seq: 935, Ack: 1054, Len: 32
SSH Protocol
    SSH Version 2
        Packet Length: 28
        Padding Length: 14
        Key Exchange
            Message Code: Diffie-Hellman Group Exchange Request (34)
            DH GEX Min: 1024
            DH GEX Number of Bits: 1024
            DH GEX Max: 8192
            Padding String: 5af7262e4faf84fda82344c2f6c1
			
Server: DH Groupe Exchange Groupe:
Frame 27: 1102 bytes on wire (8816 bits), 1102 bytes captured (8816 bits) on interface 0
Ethernet II, Src: TecoAS_84:bc:63 (00:0a:14:84:bc:63), Dst: Broadcom_cc:0e:a4 (00:10:18:cc:0e:a4)
Internet Protocol Version 4, Src: 192.168.1.1, Dst: 192.168.1.2
Transmission Control Protocol, Src Port: 22, Dst Port: 63563, Seq: 1054, Ack: 967, Len: 1048
SSH Protocol
    SSH Version 2 (encryption:aes256-ctr mac:hmac-sha1 compression:none)
        Packet Length: 1044
        Padding Length: 8
        Key Exchange
            Message Code: Diffie-Hellman Group Exchange Group (31)
            Multi Precision Integer Length: 1025
            DH modulus (P): 00ffffffffffffffffc90fdaa22168c234c4c6628b80dc1c...
            Multi Precision Integer Length: 1
            DH base (G): 02
            Padding String: 0000000000000000
			


Client Diffie-Hellman Group Exchange Init:
Frame 29: 1102 bytes on wire (8816 bits), 1102 bytes captured (8816 bits) on interface 0
Ethernet II, Src: Broadcom_cc:0e:a4 (00:10:18:cc:0e:a4), Dst: TecoAS_84:bc:63 (00:0a:14:84:bc:63)
Internet Protocol Version 4, Src: 192.168.1.2, Dst: 192.168.1.1
Transmission Control Protocol, Src Port: 63563, Dst Port: 22, Seq: 967, Ack: 2102, Len: 1048
SSH Protocol
    SSH Version 2
        Packet Length: 1044
        Padding Length: 14
        Key Exchange
            Message Code: Diffie-Hellman Group Exchange Init (32)
            Multi Precision Integer Length: 1024
            DH client e: 53cdf1399bdd1985430f11b1610f6da317766d5b4680b75f...
            Padding String: 8e9a5bc028460a6791ec8002a6e6

			

Server Diffie-Hellman Group Exchange Reply:
Frame 32: 154 bytes on wire (1232 bits), 154 bytes captured (1232 bits) on interface 0
Ethernet II, Src: TecoAS_84:bc:63 (00:0a:14:84:bc:63), Dst: Broadcom_cc:0e:a4 (00:10:18:cc:0e:a4)
Internet Protocol Version 4, Src: 192.168.1.1, Dst: 192.168.1.2
Transmission Control Protocol, Src Port: 22, Dst Port: 63563, Seq: 3362, Ack: 2015, Len: 100
[2 Reassembled TCP Segments (1344 bytes): #31(1260), #32(84)]
SSH Protocol
    SSH Version 2 (encryption:aes256-ctr mac:hmac-sha1 compression:none)
        Packet Length: 1340
        Padding Length: 7
        Key Exchange
            Message Code: Diffie-Hellman Group Exchange Reply (33)
            Host key length: 151
            KEX DH host key: 000000077373682d727361000000030100010000008100e2...
            Multi Precision Integer Length: 1025
            DH server f: 00e8a76caee67e8a0d68950fe9428f732f03c39102fe34ac...
            KEX DH H signature length: 143
            KEX DH H signature: 000000077373682d7273610000008032726dc6251ded1152...
            Padding String: 00000000000000
SSH Protocol
    SSH Version 2 (encryption:aes256-ctr mac:hmac-sha1 compression:none)
        Packet Length: 12
        Padding Length: 10
        Key Exchange
            Message Code: New Keys (21)
            Padding String: 00000000000000000000

```

**Comment by fidergo-stephane-gourichon** [comment]
@drieseng Any hint about what's happening?

**Comment by drieseng** [comment]
I just upgraded myself, and have yet to find any issue.
What version of SSH.NET are you using ?
Also, please check the server log (/var/log/auth.log).

**Comment by serjtc** [comment]
Unfortunately the auth.log  shows no records.

I have tested using the SSH.NET 2016.0.0 from NuGet, as well as the latest source on github.

**Comment by drieseng** [comment]
Please try setting the log level to DEBUG3 for both SSH and SFTP:

SyslogFacility AUTH
LogLevel DEBUG3
Subsystem sftp /usr/lib/openssh/sftp-server -l DEBUG3

**Comment by serjtc** [comment]
Sorry i have missed this. 

This is what i got:

> 2016-11-28 14:53:23 sshd[1033]: debug3: fd 5 is not O_NONBLOCK
> 2016-11-28 14:53:23 sshd[1033]: debug1: Forked child 1451.
> 2016-11-28 14:53:23 sshd[1033]: debug3: send_rexec_state: entering fd = 8 config len 305
> 2016-11-28 14:53:23 sshd[1033]: debug3: ssh_msg_send: type 0
> 2016-11-28 14:53:23 sshd[1033]: debug3: send_rexec_state: done
> 2016-11-28 14:53:23 sshd[1451]: debug3: oom_adjust_restore
> 2016-11-28 14:53:23 sshd[1451]: debug1: Set /proc/self/oom_score_adj to 0
> 2016-11-28 14:53:23 sshd[1451]: debug1: rexec start in 5 out 5 newsock 5 pipe 7 sock 8
> 2016-11-28 14:53:23 sshd[1451]: debug1: inetd sockets after dupping: 3, 3
> 2016-11-28 14:53:23 sshd[1451]: Connection from 192.168.1.2 port 56475 on 192.168.1.1 port 22
> 2016-11-28 14:53:23 sshd[1451]: debug1: Client protocol version 2.0; client software version Renci.SshNet.SshClient.0.0.1
> 2016-11-28 14:53:23 sshd[1451]: debug1: no match: Renci.SshNet.SshClient.0.0.1
> 2016-11-28 14:53:23 sshd[1451]: debug1: Enabling compatibility mode for protocol 2.0
> 2016-11-28 14:53:23 sshd[1451]: debug1: Local version string SSH-2.0-OpenSSH_7.3
> 2016-11-28 14:53:23 sshd[1451]: debug2: fd 3 setting O_NONBLOCK
> 2016-11-28 14:53:23 sshd[1451]: debug1: list_hostkey_types: ssh-rsa,rsa-sha2-512,rsa-sha2-256
> 2016-11-28 14:53:23 sshd[1451]: debug3: send packet: type 20
> 2016-11-28 14:53:23 sshd[1451]: debug1: SSH2_MSG_KEXINIT sent
> 2016-11-28 14:53:23 sshd[1451]: debug3: receive packet: type 20
> 2016-11-28 14:53:23 sshd[1451]: debug1: SSH2_MSG_KEXINIT received
> 2016-11-28 14:53:23 sshd[1451]: debug2: local server KEXINIT proposal
> 2016-11-28 14:53:23 sshd[1451]: debug2: KEX algorithms: curve25519-sha256@libssh.org,ecdh-sha2-nistp256,ecdh-sha2-nistp384,ecdh-sha2-nistp521,diffie-hellman-group-exchange-sha256,diffie-hellman-group16-sha512,diffie-hellman-group18-sha512,diffie-hellman-group14-sha256,diffie-hellman-group14-sha1
> 2016-11-28 14:53:23 sshd[1451]: debug2: host key algorithms: ssh-rsa,rsa-sha2-512,rsa-sha2-256
> 2016-11-28 14:53:23 sshd[1451]: debug2: ciphers ctos: chacha20-poly1305@openssh.com,aes128-ctr,aes192-ctr,aes256-ctr,aes128-gcm@openssh.com,aes256-gcm@openssh.com
> 2016-11-28 14:53:23 sshd[1451]: debug2: ciphers stoc: chacha20-poly1305@openssh.com,aes128-ctr,aes192-ctr,aes256-ctr,aes128-gcm@openssh.com,aes256-gcm@openssh.com
> 2016-11-28 14:53:23 sshd[1451]: debug2: MACs ctos: umac-64-etm@openssh.com,umac-128-etm@openssh.com,hmac-sha2-256-etm@openssh.com,hmac-sha2-512-etm@openssh.com,hmac-sha1-etm@openssh.com,umac-64@openssh.com,umac-128@openssh.com,hmac-sha2-256,hmac-sha2-512,hmac-sha1
> 2016-11-28 14:53:23 sshd[1451]: debug2: MACs stoc: umac-64-etm@openssh.com,umac-128-etm@openssh.com,hmac-sha2-256-etm@openssh.com,hmac-sha2-512-etm@openssh.com,hmac-sha1-etm@openssh.com,umac-64@openssh.com,umac-128@openssh.com,hmac-sha2-256,hmac-sha2-512,hmac-sha1
> 2016-11-28 14:53:23 sshd[1451]: debug2: compression ctos: none,zlib@openssh.com
> 2016-11-28 14:53:23 sshd[1451]: debug2: compression stoc: none,zlib@openssh.com
> 2016-11-28 14:53:23 sshd[1451]: debug2: languages ctos:
> 2016-11-28 14:53:23 sshd[1451]: debug2: languages stoc:
> 2016-11-28 14:53:23 sshd[1451]: debug2: first_kex_follows 0
> 2016-11-28 14:53:23 sshd[1451]: debug2: reserved 0
> 2016-11-28 14:53:23 sshd[1451]: debug2: peer client KEXINIT proposal
> 2016-11-28 14:53:23 sshd[1451]: debug2: KEX algorithms: diffie-hellman-group-exchange-sha256,diffie-hellman-group-exchange-sha1,diffie-hellman-group14-sha1,diffie-hellman-group1-sha1
> 2016-11-28 14:53:23 sshd[1451]: debug2: host key algorithms: ssh-rsa,ssh-dss
> 2016-11-28 14:53:23 sshd[1451]: debug2: ciphers ctos: aes256-ctr,3des-cbc,aes128-cbc,aes192-cbc,aes256-cbc,blowfish-cbc,twofish-cbc,twofish192-cbc,twofish128-cbc,twofish256-cbc,arcfour,arcfour128,arcfour256,cast128-cbc,aes128-ctr,aes192-ctr
> 2016-11-28 14:53:23 sshd[1451]: debug2: ciphers stoc: aes256-ctr,3des-cbc,aes128-cbc,aes192-cbc,aes256-cbc,blowfish-cbc,twofish-cbc,twofish192-cbc,twofish128-cbc,twofish256-cbc,arcfour,arcfour128,arcfour256,cast128-cbc,aes128-ctr,aes192-ctr
> 2016-11-28 14:53:23 sshd[1451]: debug2: MACs ctos: hmac-md5,hmac-sha1,hmac-sha2-256,hmac-sha2-256-96,hmac-ripemd160,hmac-ripemd160@openssh.com,hmac-md5-96,hmac-sha1-96
> 2016-11-28 14:53:23 sshd[1451]: debug2: MACs stoc: hmac-md5,hmac-sha1,hmac-sha2-256,hmac-sha2-256-96,hmac-ripemd160,hmac-ripemd160@openssh.com,hmac-md5-96,hmac-sha1-96
> 2016-11-28 14:53:23 sshd[1451]: debug2: compression ctos: none
> 2016-11-28 14:53:23 sshd[1451]: debug2: compression stoc: none
> 2016-11-28 14:53:23 sshd[1451]: debug2: languages ctos:
> 2016-11-28 14:53:23 sshd[1451]: debug2: languages stoc:
> 2016-11-28 14:53:23 sshd[1451]: debug2: first_kex_follows 0
> 2016-11-28 14:53:23 sshd[1451]: debug2: reserved 0
> 2016-11-28 14:53:23 sshd[1451]: debug1: kex: algorithm: diffie-hellman-group-exchange-sha256
> 2016-11-28 14:53:23 sshd[1451]: debug1: kex: host key algorithm: ssh-rsa
> 2016-11-28 14:53:23 sshd[1451]: debug1: kex: client-server cipher: aes256-ctr MAC: hmac-sha1 compression: none
> 2016-11-28 14:53:23 sshd[1451]: debug1: kex: server-client cipher: aes256-ctr MAC: hmac-sha1 compression: none
> 2016-11-28 14:53:23 sshd[1451]: debug1: expecting SSH2_MSG_KEX_DH_GEX_REQUEST
> 2016-11-28 14:53:23 sshd[1451]: debug3: receive packet: type 34
> 2016-11-28 14:53:23 sshd[1451]: debug1: SSH2_MSG_KEX_DH_GEX_REQUEST received
> 2016-11-28 14:53:23 sshd[1451]: debug3: dh_new_group_fallback: requested max size 8192
> 2016-11-28 14:53:23 sshd[1451]: debug3: using 8k bit group 18
> 2016-11-28 14:53:23 sshd[1451]: debug1: SSH2_MSG_KEX_DH_GEX_GROUP sent
> 2016-11-28 14:53:23 sshd[1451]: debug3: send packet: type 31
> 2016-11-28 14:53:23 sshd[1451]: debug2: bits set: 4070/8192
> 2016-11-28 14:53:23 sshd[1451]: debug1: expecting SSH2_MSG_KEX_DH_GEX_INIT
> 2016-11-28 14:53:44 sshd[1451]: debug3: receive packet: type 32
> 2016-11-28 14:53:44 sshd[1451]: debug2: bits set: 4123/8192
> 2016-11-28 14:53:45 sshd[1451]: debug3: send packet: type 33
> 2016-11-28 14:53:45 sshd[1451]: debug3: send packet: type 21
> 2016-11-28 14:53:45 sshd[1451]: debug2: set_newkeys: mode 1
> 2016-11-28 14:53:45 sshd[1451]: debug1: rekey after 4294967296 blocks
> 2016-11-28 14:53:45 sshd[1451]: debug1: SSH2_MSG_NEWKEYS sent
> 2016-11-28 14:53:45 sshd[1451]: debug1: expecting SSH2_MSG_NEWKEYS
> 
>

**Comment by drieseng** [comment]
I quickly added a little extra tracing.
Can you rebuild from source (develop branch)?
If that doesn't help, I'll have to provide a version with an insane amount of tracing :p

**Comment by serjtc** [comment]
Hi, unfortunately it does not go inside the if where you have plased the debug. I have added the message 
`DiagnosticAbstraction.Log(string.Format("[{0}]Sergiu Debug '{1}': '{2}'.", ToHex(SessionId), message.GetType().Name, message));`
before the if. This is the log:

> SshNet.Logging Verbose: 12 : Initiating connect to '192.168.1.1:22'.
>SshNet.Logging Verbose: 12 : Server version '2.0' on 'OpenSSH_7.3'.
>SshNet.Logging Verbose: 14 : [] ReceiveMessage from server: 'KeyExchangeInitMessage': 'SSH_MSG_KEXINIT'.
>**SshNet.Logging Verbose: 14 : []Sergiu Debug 'KeyExchangeInitMessage': 'SSH_MSG_KEXINIT'.**
>SshNet.Logging Verbose: 14 : [] SendMessage to server 'KeyExchangeInitMessage': 'SSH_MSG_KEXINIT'.
>**SshNet.Logging Verbose: 14 : []Sergiu Debug 'KeyExchangeDhGroupExchangeRequest': 'SSH_MSG_KEX_DH_GEX_REQUEST'.**
>SshNet.Logging Verbose: 14 : [] SendMessage to server 'KeyExchangeDhGroupExchangeRequest': 'SSH_MSG_KEX_DH_GEX_REQUEST'.
>SshNet.Logging Verbose: 14 : [] ReceiveMessage from server: 'KeyExchangeDhGroupExchangeGroup': 'SSH_MSG_KEX_DH_GEX_GROUP'.
>Der Thread '<Kein Name>' (0x59cc) hat mit Code 0 (0x0) geendet.
>Der Thread '<Kein Name>' (0x41b8) hat mit Code 0 (0x0) geendet.
>**SshNet.Logging Verbose: 14 : []Sergiu Debug 'KeyExchangeDhGroupExchangeInit': 'SSH_MSG_KEX_DH_GEX_INIT'.**
>SshNet.Logging Verbose: 14 : [] SendMessage to server 'KeyExchangeDhGroupExchangeInit': 'SSH_MSG_KEX_DH_GEX_INIT'.
>SshNet.Logging Verbose: 14 : [] ReceiveMessage from server: 'KeyExchangeDhGroupExchangeReply': 'SSH_MSG_KEX_DH_GEX_REPLY'.
>Eine Ausnahme (erste Chance) des Typs "Renci.SshNet.Common.SshOperationTimeoutException" ist in Test.exe aufgetreten.
>SshNet.Logging Verbose: 12 : 636161050834200779 Disposing client
>SshNet.Logging Verbose: 12 : 636161050834220782 Disconnecting client
>SshNet.Logging Verbose: 12 : [] Disposing session
>SshNet.Logging Verbose: 12 : [] 636161050834250785 Disconnecting session
>SshNet.Logging Verbose: 12 : [] Shutting down socket.
>SshNet.Logging Verbose: 12 : [] Disposing socket.
>SshNet.Logging Verbose: 12 : [] Disposed socket.

**Comment by drieseng** [comment]
Can you provide the full stacktrace of the exception that you get?
Do you get the exception almost immediately, or after a timeout (eg. 30 seconds)?
Also provide the smallest code fragment that you can use to reproduce this issue.

**Comment by serjtc** [comment]
Not to much:
`bei Renci.SshNet.Session.WaitOnHandle(WaitHandle waitHandle, TimeSpan timeout)`
`bei Renci.SshNet.Session.WaitOnHandle(WaitHandle waitHandle)`
`bei Renci.SshNet.Session.Connect()`
`bei Renci.SshNet.BaseClient.Connect()`
`bei Test.Form1.backgroundWorker1_DoWork(Object sender, EventArgs e) `

The Exception comes after about 30 sec.

The Code example is very simple:

`SshClient cSSH = new SshClient(TestIP, 22, "root", "root");`
`cSSH.Connect();`


I have copied the 2 lines to a new form in the  `private void button1_Click(object sender, EventArgs e)` (without the backgroundWorker) and got the same negative result.

**Comment by chelleb** [comment]
Having the same problem (no issues when run against 7.2).  I have also tested using the SSH.NET 2016.0.0 from NuGet, as well as the latest source on github.

Exceptions immediately on connect:
using (var privateKey = Assembly.GetExecutingAssembly().GetManifestResourceStream("Sample.Net.Resources.My.key"))
using (var client = new SftpClient(host, port, user, new PrivateKeyFile(privateKey, @"xxxxxxxxxxxxxxxxxxxxxxxxxxxxxxxxxxxxxxxxxxxxx")))
{
	client.Connect();
}

Sample.Job v1.0.3|2016-12-02 07:15:03.0076|INFO||Sample.Job|Renci.SshNet.Common.SshConnectionException: An established connection was aborted by the server.
   at Renci.SshNet.Session.WaitOnHandle(WaitHandle waitHandle, TimeSpan timeout) in \SSH.NET-develop\SSH.NET-develop\src\Renci.SshNet\Session.cs:line 810
   at Renci.SshNet.Session.WaitOnHandle(WaitHandle waitHandle) in \SSH.NET-develop\SSH.NET-develop\src\Renci.SshNet\Session.cs:line 783
   at Renci.SshNet.Session.Connect() in \SSH.NET-develop\SSH.NET-develop\src\Renci.SshNet\Session.cs:line 643
   at Renci.SshNet.BaseClient.Connect() in \SSH.NET-develop\SSH.NET-develop\src\Renci.SshNet\BaseClient.cs:line 214

**Comment by drieseng** [comment]
@serjtc:

By looking at the server log, we can see that there's supposedly 21 seconds between the moment  the server sends **SSH2_MSG_KEX_DH_GEX_GROUP** and the moment it receives **SSH2_MSG_KEX_DH_GEX_INIT**.

The server then sends a **SSH2_MSG_NEWKEYS** message, but we see no trace of it in the client log.
We could conclude that the client already timed out, but there appear to be "only" 21 seconds between initiating the connection and the moment the server sends the **SSH2_MSG_NEWKEYS**. This is well below the default client connection timeout, which is 30 seconds.

Also, we should be sending a **SSH2_MSG_NEWKEYS** message once we receive the **SSH_MSG_KEX_DH_GEX_REPLY** message from the server. Again, I find no trace of that in your client log.

I've added a timestamp to the tracing we write. Please rebuild again from the **develop** branch, and send me both the client and the server log.

Also, please try increasing the client connection timeout:

```cs
SshClient cSSH = new SshClient(TestIP, 22, "root", "root");
cSSH.ConnectionInfo.Timeout = TimeSpan.FromSeconds(60);
cSSH.Connect();
```

Note that I don't consider this a solution.
I just want to know if and when we actually send and receive the **SSH2_MSG_NEWKEYS** message.

**Comment by serjtc** [comment]
So, finally: The code with the Timeout 60:

`SshNet.Logging Verbose: 12 : 12.12.2016 11:02:24: Initiating connect to '192.168.1.1:22'.`
`SshNet.Logging Verbose: 12 : 12.12.2016 11:02:41: Server version '2.0' on 'OpenSSH_7.3'.`
`SshNet.Logging Verbose: 15 : 12.12.2016 11:02:42: [] ReceiveMessage from server: 'KeyExchangeInitMessage': 'SSH_MSG_KEXINIT'.`
`SshNet.Logging Verbose: 15 : 12.12.2016 11:02:42: [] SendMessage to server 'KeyExchangeInitMessage': 'SSH_MSG_KEXINIT'.`
`SshNet.Logging Verbose: 15 : 12.12.2016 11:02:42: [] SendMessage to server 'KeyExchangeDhGroupExchangeRequest': 'SSH_MSG_KEX_DH_GEX_REQUEST'.`
`SshNet.Logging Verbose: 15 : 12.12.2016 11:02:42: [] ReceiveMessage from server: 'KeyExchangeDhGroupExchangeGroup': 'SSH_MSG_KEX_DH_GEX_GROUP'.`
`Der Thread '<Kein Name>' (0x1c7c) hat mit Code 0 (0x0) geendet.`
`Der Thread '<Kein Name>' (0x224c) hat mit Code 0 (0x0) geendet.`
`SshNet.Logging Verbose: 15 : 12.12.2016 11:03:04: [] SendMessage to server 'KeyExchangeDhGroupExchangeInit': 'SSH_MSG_KEX_DH_GEX_INIT'.`
`SshNet.Logging Verbose: 15 : 12.12.2016 11:03:05: [] ReceiveMessage from server: 'KeyExchangeDhGroupExchangeReply': 'SSH_MSG_KEX_DH_GEX_REPLY'.`
`Der Thread '<Kein Name>' (0x209c) hat mit Code 0 (0x0) geendet.`
`SshNet.Logging Verbose: 15 : 12.12.2016 11:03:26: [] SendMessage to server 'NewKeysMessage': 'SSH_MSG_NEWKEYS'.`
`SshNet.Logging Verbose: 15 : 12.12.2016 11:03:27: [] ReceiveMessage from server: 'NewKeysMessage': 'SSH_MSG_NEWKEYS'.`
`SshNet.Logging Verbose: 15 : 12.12.2016 11:03:27: [4600BC5A450E9613058EEE672F79A003E3F087AC6ED4A1D804777BFD480BD261] Creating server cipher (Name:aes256-ctr,Key:ED772D3377A598901C3DBD4699E2D6740F31033A3B8F5F1A60D04B7C983C9934,IV:94C407E42DA0F1765CC99ED20E35CA84A308DF0692DC09A400BADB6D257A1A11)`
`SshNet.Logging Verbose: 12 : 12.12.2016 11:03:27: [4600BC5A450E9613058EEE672F79A003E3F087AC6ED4A1D804777BFD480BD261] SendMessage to server 'ServiceRequestMessage': 'SSH_MSG_SERVICE_REQUEST'.`
`SshNet.Logging Verbose: 15 : 12.12.2016 11:03:27: [4600BC5A450E9613058EEE672F79A003E3F087AC6ED4A1D804777BFD480BD261] ReceiveMessage from server: 'ServiceAcceptMessage': 'SSH_MSG_SERVICE_ACCEPT'.`
`SshNet.Logging Verbose: 12 : 12.12.2016 11:03:27: [4600BC5A450E9613058EEE672F79A003E3F087AC6ED4A1D804777BFD480BD261] SendMessage to server 'RequestMessageNone': 'SSH_MSG_USERAUTH_REQUEST'.`
`SshNet.Logging Verbose: 15 : 12.12.2016 11:03:27: [4600BC5A450E9613058EEE672F79A003E3F087AC6ED4A1D804777BFD480BD261] ReceiveMessage from server: 'FailureMessage': 'SSH_MSG_USERAUTH_FAILURE'.`
`SshNet.Logging Verbose: 12 : 12.12.2016 11:03:27: [4600BC5A450E9613058EEE672F79A003E3F087AC6ED4A1D804777BFD480BD261] SendMessage to server 'RequestMessagePassword': 'SSH_MSG_USERAUTH_REQUEST'.`
`SshNet.Logging Verbose: 15 : 12.12.2016 11:03:27: [4600BC5A450E9613058EEE672F79A003E3F087AC6ED4A1D804777BFD480BD261] ReceiveMessage from server: 'SuccessMessage': 'SSH_MSG_USERAUTH_SUCCESS'.`
`SshNet.Logging Verbose: 12 : 12.12.2016 11:03:27: [4600BC5A450E9613058EEE672F79A003E3F087AC6ED4A1D804777BFD480BD261] SendMessage to server 'ChannelOpenMessage': 'SSH_MSG_CHANNEL_OPEN'.`
`SshNet.Logging Verbose: 15 : 12.12.2016 11:03:27: [4600BC5A450E9613058EEE672F79A003E3F087AC6ED4A1D804777BFD480BD261] ReceiveMessage from server: 'GlobalRequestMessage': 'SSH_MSG_GLOBAL_REQUEST'.`
`SshNet.Logging Verbose: 15 : 12.12.2016 11:03:27: [4600BC5A450E9613058EEE672F79A003E3F087AC6ED4A1D804777BFD480BD261] ReceiveMessage from server: 'ChannelOpenConfirmationMessage': 'SSH_MSG_CHANNEL_OPEN_CONFIRMATION : #0'.`
`SshNet.Logging Verbose: 12 : 12.12.2016 11:03:27: [4600BC5A450E9613058EEE672F79A003E3F087AC6ED4A1D804777BFD480BD261] SendMessage to server 'ChannelRequestMessage': 'SSH_MSG_CHANNEL_REQUEST : #0'.`
`SshNet.Logging Verbose: 15 : 12.12.2016 11:03:27: [4600BC5A450E9613058EEE672F79A003E3F087AC6ED4A1D804777BFD480BD261] ReceiveMessage from server: 'ChannelWindowAdjustMessage': 'SSH_MSG_CHANNEL_WINDOW_ADJUST : #0'.`
`SshNet.Logging Verbose: 15 : 12.12.2016 11:03:27: [4600BC5A450E9613058EEE672F79A003E3F087AC6ED4A1D804777BFD480BD261] ReceiveMessage from server: 'ChannelSuccessMessage': 'SSH_MSG_CHANNEL_SUCCESS : #0'.`
`SshNet.Logging Verbose: 12 : 12.12.2016 11:03:27: [4600BC5A450E9613058EEE672F79A003E3F087AC6ED4A1D804777BFD480BD261] SendMessage to server 'ChannelDataMessage': 'SSH_MSG_CHANNEL_DATA : #0'.`
`SshNet.Logging Verbose: 15 : 12.12.2016 11:03:27: [4600BC5A450E9613058EEE672F79A003E3F087AC6ED4A1D804777BFD480BD261] ReceiveMessage from server: 'ChannelDataMessage': 'SSH_MSG_CHANNEL_DATA : #0'.`
`SshNet.Logging Verbose: 12 : 12.12.2016 11:03:27: [4600BC5A450E9613058EEE672F79A003E3F087AC6ED4A1D804777BFD480BD261] SendMessage to server 'ChannelDataMessage': 'SSH_MSG_CHANNEL_DATA : #0'.`
`SshNet.Logging Verbose: 15 : 12.12.2016 11:03:27: [4600BC5A450E9613058EEE672F79A003E3F087AC6ED4A1D804777BFD480BD261] ReceiveMessage from server: 'ChannelDataMessage': 'SSH_MSG_CHANNEL_DATA : #0'.`
`SshNet.Logging Verbose: 12 : 12.12.2016 11:03:27: 636171374073128660 Disconnecting client`
`SshNet.Logging Verbose: 12 : 12.12.2016 11:03:27: [4600BC5A450E9613058EEE672F79A003E3F087AC6ED4A1D804777BFD480BD261] SendMessage to server 'ChannelEofMessage': 'SSH_MSG_CHANNEL_EOF : #0'.`
`SshNet.Logging Verbose: 12 : 12.12.2016 11:03:27: [4600BC5A450E9613058EEE672F79A003E3F087AC6ED4A1D804777BFD480BD261] SendMessage to server 'ChannelCloseMessage': 'SSH_MSG_CHANNEL_CLOSE : #0'.`
`SshNet.Logging Verbose: 15 : 12.12.2016 11:03:27: [4600BC5A450E9613058EEE672F79A003E3F087AC6ED4A1D804777BFD480BD261] ReceiveMessage from server: 'ChannelRequestMessage': 'SSH_MSG_CHANNEL_REQUEST : #0'.`
`SshNet.Logging Verbose: 15 : 12.12.2016 11:03:27: [4600BC5A450E9613058EEE672F79A003E3F087AC6ED4A1D804777BFD480BD261] ReceiveMessage from server: 'ChannelCloseMessage': 'SSH_MSG_CHANNEL_CLOSE : #0'.`
`SshNet.Logging Verbose: 12 : 12.12.2016 11:03:27: [4600BC5A450E9613058EEE672F79A003E3F087AC6ED4A1D804777BFD480BD261] Disposing session`
`SshNet.Logging Verbose: 12 : 12.12.2016 11:03:27: [4600BC5A450E9613058EEE672F79A003E3F087AC6ED4A1D804777BFD480BD261] 636171374073398675 Disconnecting session`
`SshNet.Logging Verbose: 12 : 12.12.2016 11:03:27: [4600BC5A450E9613058EEE672F79A003E3F087AC6ED4A1D804777BFD480BD261] SendMessage to server 'DisconnectMessage': 'SSH_MSG_DISCONNECT'.`
`SshNet.Logging Verbose: 12 : 12.12.2016 11:03:27: [4600BC5A450E9613058EEE672F79A003E3F087AC6ED4A1D804777BFD480BD261] Shutting down socket.`
`SshNet.Logging Verbose: 12 : 12.12.2016 11:03:27: [4600BC5A450E9613058EEE672F79A003E3F087AC6ED4A1D804777BFD480BD261] Disposing socket.`
`SshNet.Logging Verbose: 12 : 12.12.2016 11:03:27: [4600BC5A450E9613058EEE672F79A003E3F087AC6ED4A1D804777BFD480BD261] Disposed socket.`
`SshNet.Logging Verbose: 15 : 12.12.2016 11:03:27: [4600BC5A450E9613058EEE672F79A003E3F087AC6ED4A1D804777BFD480BD261] 636171374073458678 Raised exception: Renci.SshNet.Common.SshConnectionException: An established connection was aborted by the server.`
`SshNet.Logging Verbose: 12 : 12.12.2016 11:03:27: 636171374073478680 Disposing client`
`SshNet.Logging Verbose: 12 : 12.12.2016 11:03:27: 636171374073488680 Disconnecting client`

**Comment by serjtc** [comment]
The same without the Timeout:
`SshNet.Logging Verbose: 6 : 12.12.2016 11:08:39: Initiating connect to '192.168.1.1:22'.`
`SshNet.Logging Verbose: 6 : 12.12.2016 11:08:39: Server version '2.0' on 'OpenSSH_7.3'.`
`SshNet.Logging Verbose: 14 : 12.12.2016 11:08:39: [] ReceiveMessage from server: 'KeyExchangeInitMessage': 'SSH_MSG_KEXINIT'.`
`SshNet.Logging Verbose: 14 : 12.12.2016 11:08:39: [] SendMessage to server 'KeyExchangeInitMessage': 'SSH_MSG_KEXINIT'.`
`SshNet.Logging Verbose: 14 : 12.12.2016 11:08:39: [] SendMessage to server 'KeyExchangeDhGroupExchangeRequest': 'SSH_MSG_KEX_DH_GEX_REQUEST'.`
`SshNet.Logging Verbose: 14 : 12.12.2016 11:08:40: [] ReceiveMessage from server: 'KeyExchangeDhGroupExchangeGroup': 'SSH_MSG_KEX_DH_GEX_GROUP'.`
`Der Thread '<Kein Name>' (0x27c4) hat mit Code 0 (0x0) geendet.`
`Der Thread '<Kein Name>' (0x3b0) hat mit Code 0 (0x0) geendet.`
`SshNet.Logging Verbose: 14 : 12.12.2016 11:09:02: [] SendMessage to server 'KeyExchangeDhGroupExchangeInit': 'SSH_MSG_KEX_DH_GEX_INIT'.`
`SshNet.Logging Verbose: 14 : 12.12.2016 11:09:02: [] ReceiveMessage from server: 'KeyExchangeDhGroupExchangeReply': 'SSH_MSG_KEX_DH_GEX_REPLY'.`
`Eine Ausnahme (erste Chance) des Typs "Renci.SshNet.Common.SshOperationTimeoutException" ist in ConelSDBoootExt4.exe aufgetreten.`
`SshNet.Logging Verbose: 6 : 12.12.2016 11:09:09: 636171377498104557 Disposing client`
`SshNet.Logging Verbose: 6 : 12.12.2016 11:09:09: 636171377498114558 Disconnecting client`
`SshNet.Logging Verbose: 6 : 12.12.2016 11:09:09: [] Disposing session`
`SshNet.Logging Verbose: 6 : 12.12.2016 11:09:09: [] 636171377498144559 Disconnecting session`
`SshNet.Logging Verbose: 6 : 12.12.2016 11:09:09: [] Shutting down socket.`
`SshNet.Logging Verbose: 6 : 12.12.2016 11:09:09: [] Disposing socket.`
`SshNet.Logging Verbose: 6 : 12.12.2016 11:09:09: [] Disposed socket.`
`Der Thread '<Kein Name>' (0x21d0) hat mit Code 0 (0x0) geendet.`
`Eine Ausnahme (erste Chance) des Typs "Renci.SshNet.Common.SshConnectionException" ist in Test.exe aufgetreten.`
`"Test.vshost.exe" (Verwaltet (v4.0.30319)): "C:\Windows\Microsoft.Net\assembly\GAC_MSIL\mscorlib.resources\v4.0_4.0.0.0_de_b77a5c561934e089\mscorlib.resources.dll" geladen`
`SshNet.Logging Verbose: 14 : 12.12.2016 11:09:24: [] 636171377649313206 Raised exception: Renci.SshNet.Common.SshConnectionException: Client not connected.`
   `bei Renci.SshNet.Session.SendMessage(Message message) in D:\Renci.SshNet\Session.cs:Zeile 838.`
   `bei Renci.SshNet.Security.KeyExchange.SendMessage(Message message) in D:\Renci.SshNet\Security\KeyExchange.cs:Zeile 340.`
   `bei Renci.SshNet.Security.KeyExchange.Finish() in D:\Renci.SshNet\Security\KeyExchange.cs:Zeile 165.`
   `bei Renci.SshNet.Security.KeyExchangeDiffieHellmanGroupExchangeShaBase.Finish() in D:\Renci.SshNet\Security\KeyExchangeDiffieHellmanGroupExchangeShaBase.cs:Zeile 67.`
   `bei Renci.SshNet.Security.KeyExchangeDiffieHellmanGroupExchangeShaBase.Session_KeyExchangeDhGroupExchangeReplyReceived(Object sender, MessageEventArgs1 e) in D:\Renci.SshNet\Security\KeyExchangeDiffieHellmanGroupExchangeShaBase.cs:Zeile 110.`
   `bei Renci.SshNet.Session.OnKeyExchangeDhGroupExchangeReplyReceived(KeyExchangeDhGroupExchangeReply message) in D:\Renci.SshNet\Session.cs:Zeile 1213.`
   `bei Renci.SshNet.Messages.Transport.KeyExchangeDhGroupExchangeReply.Process(Session session) in D:\Renci.SshNet\Messages\Transport\KeyExchangeDhGroupExchangeReply.cs:Zeile 78.`
   `bei Renci.SshNet.Session.MessageListener() in D:\Renci.SshNet\Session.cs:Zeile 1893.`
`Der Thread '<Kein Name>' (0x1cac) hat mit Code 0 (0x0) geendet.`
`Der Thread '<Kein Name>' (0x6f8) hat mit Code 0 (0x0) geendet.`

**Comment by chelleb** [comment]
My issue is resolved, required re-verification of host key.

**Comment by andreaaraldo** [comment]
@chelleb 
Do you mean that removing the entries from ~/.ssh/known_hosts, it should work? I tried this and it does not work for me

**Comment by drieseng** [comment]
No feedback since ages.
Please open a new issue if you still run into this problem.
